ID	Source	Target	Type	Style	Dataset
ted_en2pt_6643	When I was teaching [at a middle school] , we asked our students to build a robot from a standard technology kit .	Quando dava aulas [no 2º / 3º ciclo] , pedimos aos nossos alunos para construírem um robô com um kit de tecnologia .	SYS_DESC	R	POOL
ted_en2pt_6662	This statistic might look familiar if you walked into a [high school] robotics club , or a [college] engineering class .	Esta estatística pode parecer familiar se entrarmos num clube de robótica do [secundário] , ou numa aula de engenharia de uma [faculdade] .	"SYS_DESC; SYS_CONV"	"R; R"	POOL
ted_en2pt_672	"Why hasn &apos;t that made a comeback ? ( Laughter ) So then there was a lot more beers , and then the day ended with a challenge to bring the mustache back . ( Laughter ) So in Australia , &quot; &quot; mo &quot; &quot; is slang for mustache , so we renamed the month of November &quot; &quot; Movember &quot; &quot; and created some pretty basic rules , which still stand today ."	"&quot; &quot; porque é que não voltou a estar na moda ? &quot; &quot; ( Risos ) Logo houve muitas mais cervejas , e o dia acabou com o desafio de trazer o bigode de volta . ( Risos ) Portanto , na Austrália &quot; &quot; Mo &quot; &quot; é calão para bigode [&#91; mustache &#93;] , então renomeámos o mês de Novembro para &quot; &quot; Movembro &quot; &quot; , e criámos algumas regras básicas que se mantêm até à data ,"	TRANS	R	POOL
ted_en2pt_694	"So we &apos;d racked up at this stage about [600,000 dollars] worth of debt . So if Movember 2006 didn &apos;t happen , the four founders , well , we would &apos;ve been broke , we would &apos;ve been homeless , sitting on the street with mustaches . ( Laughter ) But we thought , you know what , if that &apos;s the worst thing that happens , so what ?"	"Acumulámos uma dívida nesta fase de cerca de [460 mil euros] . Portanto , se o Movembro de 2006 não acontecesse , os seus quatro fundadores ... bem , estaríamos falidos , sem casas , sentados na rua com bigodes . ( Risos ) Mas pensámos : &quot; &quot; Sabem que mais ? Se isso é o pior &quot; &quot; que pode acontecer , e então ?"	MEAS_CONV	R	POOL
ted_en2pt_7408	Everything in [America] is so much bigger than in Europe .	Tudo nos [EUA] é muito maior do que na Europa .	ENT_REP	R	POOL
ted_en2pt_7472	"With Google Glass , we can put that underneath a helmet , and we can get a sense of what it &apos;s like to be running down the field at [100 miles an hour] , your blood pounding in your ears ."	Com o Google Glass , podemos colocá-lo debaixo de um capacete e termos a sensação de como é correr pelo campo a [160 km / h] , o sangue a pulsar nos nossos ouvidos .	MEAS_CONV	R	POOL
ted_en2pt_7473	"You can get a sense of what it &apos;s like to have a [250-pound] man sprinting at you trying to decapitate you with every ounce of his being ."	Vocês podem ter a sensação de como é ter um homem de [113 Kg] a correr atrás de vocês tentando decapitar-vos com cada grama do seu corpo .	MEAS_CONV	R	POOL
ted_en2pt_7476	"Unfortunately , it &apos;s not [NFL] practice footage because the NFL thinks emergent technology is what happens when a submarine surfaces , but — ( Laughter ) — we do what we can ."	Infelizmente , não são cenas reais da [Liga Nacional de Futebol] [Americano] ( NFL ) , porque a NFL acha que a tecnologia emergente é o que acontece quanto um submarino emerge , mas — ( Risos ) — nós fazemos o possível .	"ENT_ACR; ENT_SPEC"	"A; A"	POOL
ted_en2pt_8219	The patient has cancer , you want to know if the lymph nodes have cancer even before you go in .	"O doente tem cancro , nós queremos saber se os nódulos linfáticos têm cancro ainda antes de entrarem [&#91; para a cirurgia &#93;] ."	CLEAR	A	POOL
ted_en2pt_8261	We published our results in the [proceedings of the National Academy of Sciences] and in Nature Biotechnology .	"Publicámos os nossos resultados na [PNAS] &#91; [revista científica da Academia Nacional de Ciências] [dos EUA] &#93; e na Nature - Biotecnologia ."	"ENT_ACR; ENT_DESC; ENT_SPEC"	"R; A; A"	POOL
ted_en2pt_8741	"And this young child who &apos;d taken about an [inch and a half] out of her leg with no antiseptic , and that young boy who was a child soldier , who told me he &apos;d killed people — he was about 12 — these things made me realize that this was not a film that I could just stop ."	E esta criança a quem haviam amputado quase [4 centímetros] da perna sem antissépticos , e aquele menino que era uma criança-soldado , que me disse que tinha matado pessoas - ele tinha uns 12 anos - essas coisas fizeram-me perceber que isto não era um filme que eu poderia simplesmente parar .	MEAS_CONV	R	POOL
ted_en2pt_8906	And in the upper left , a pioneering effort 14 years ago by GM — [84 miles a gallon] without even using a hybrid , in a four-seater .	No canto superior esquerdo , um esforço pioneiro da GM de há 14 anos . [2,8 litros aos 100 km] sem sequer ser híbrido , num quatro lugares .	MEAS_CONV	R	POOL
ted_en2pt_8985	"I call this simplifying complexity , and it &apos;s what we do at the chair of systems design at [ETH Zurich] ."	"Eu chamo a isto simplificar a complexidade , e é o que fazemos na cadeira de &quot; &quot; Design &quot; &quot; de Sistemas no [Instituto Federal de Tecnologia de Zurique] ."	ENT_ACR	R	EXTR
ted_en2pt_9279	Is it reasonable still to focus on the two-degree path ?	Será razoável continuarmos a concentrar-nos na via dos 2º [C] ?	MEAS_SPEC	A	POOL
ted_en2pt_9280	"There are quite a lot of my colleagues and other scientists who would say that it &apos;s now too late to avoid a two-degree warming ."	Muitos dos meus colegas e cientistas diriam que já é demasiado tarde para impedir um aquecimento de 2º [C].	MEAS_SPEC	A	POOL
ted_en2pt_9383	"I ventured on my two-year , [27,000 mile] journey to learn where , why , and how white people are fleeing , but I didn &apos;t expect to have so much fun on my journey ."	Eu aventurei-me na minha jornada de dois anos e [43 000 km] , para perceber para onde , porquê e como é que os brancos se estão a escapar. mas não esperava divertir-me tanto nesta viagem .	MEAS_CONV	R	POOL
ted_en2pt_9451	In Australia , a lily turned into a grass tree , and in Hawaii , a daisy became a silver sword .	"Na Austrália , um lírio transformou-se numa &quot; &quot; Árvore Herbácea &quot; &quot; [&#91; &quot; &quot; genus Xanthorrhoea &quot; &quot; &#93;] e no Havai , uma margarida tornou-se numa &quot; &quot; Espada Prateada &quot; &quot; ."	ADD_INF	A	POOL
ted_en2pt_95	"In his memoirs , &quot; &quot; Long Road to Freedom , &quot; &quot; he wrote that he survived during those years of captivity because he always decided to look upon his oppressor as also being a human being , also being a human being ."	"Nas suas memórias , &quot; &quot; Long Road to Freedom &quot; &quot; [( Longo Caminho para a Liberdade )] , ele escreveu que sobreviveu durante aqueles anos de cativeiro porque sempre decidiu ver o seu opressor também como um ser humano , como sendo também um ser humano ."	TRANS	A	POOL
ted_en2pt_9559	"Well , under the category of &quot; &quot; What &apos;s the harm of silly stuff like this ? &quot; &quot; this device , the ADE 651 , was sold to the Iraqi government for [40,000 dollars] apiece ."	"Bom , sob a categoria de &quot; &quot; O que poderá esta palermice fazer de mal ? &quot; &quot; , este aparelho , o ADE 651 , foi vendido ao governo iraquiano por [27.620 euros] a unidade ."	MEAS_CONV	R	POOL
ted_en2pt_9824	Minor ampullate silk is used in web construction .	"A Seda &quot; &quot; Minor ampullate &quot; &quot; [( ampola menor )] é usada na construção de teias ."	TRANS	A	EXTR
ted_en2pt_9887	To borrow from the writings of a spider named Charlotte , silk is terrific .	"Como dizia uma aranha no livro &quot; &quot; A teia de Charlotte &quot; &quot; [( por E. B. White )] &quot; A seda é espectacular ! &quot;"	ADD_INF	A	POOL
ted_en2pt_9954	"( Laughter ) Secondly , he &apos;s [six foot five] ."	( Risos ) Segundo , mede [1,96 m] .	MEAS_CONV	R	POOL